{
  "version": 2,
  "generated_at": "2026-02-20T10:00:00Z",
  "sync": {
    "status": "ok",
    "last_started_at": "2026-02-20T09:59:59Z",
    "last_finished_at": "2026-02-20T10:00:00Z",
    "duration_ms": 923,
    "error": null,
    "warnings": []
  },
  "summary": {
    "global_count": 1,
    "project_count": 1,
    "conflict_count": 0,
    "mcp_count": 1,
    "mcp_warning_count": 0
  },
  "subagent_summary": {
    "global_count": 1,
    "project_count": 0,
    "conflict_count": 0,
    "mcp_count": 0,
    "mcp_warning_count": 0
  },
  "skills": [
    {
      "id": "skill-abc123def456",
      "name": "alpha",
      "scope": "global",
      "workspace": null,
      "canonical_source_path": "/Users/example/.claude/skills/alpha",
      "target_paths": [
        "/Users/example/.agents/skills/alpha",
        "/Users/example/.claude/skills/alpha",
        "/Users/example/.codex/skills/alpha"
      ],
      "exists": true,
      "is_symlink_canonical": false,
      "package_type": "dir",
      "skill_key": "alpha",
      "symlink_target": "/Users/example/.claude/skills/alpha",
      "status": "active",
      "archived_at": null,
      "archived_bundle_path": null,
      "archived_original_scope": null,
      "archived_original_workspace": null
    }
  ],
  "subagents": [
    {
      "id": "subagent-abc123def456",
      "name": "reviewer",
      "description": "Review code changes",
      "scope": "global",
      "workspace": null,
      "canonical_source_path": "/Users/example/.agents/subagents/reviewer.md",
      "target_paths": [
        "/Users/example/.agents/subagents/reviewer.md",
        "/Users/example/.claude/agents/reviewer.md",
        "/Users/example/.cursor/agents/reviewer.md"
      ],
      "exists": true,
      "is_symlink_canonical": false,
      "package_type": "file",
      "subagent_key": "reviewer",
      "symlink_target": "/Users/example/.agents/subagents/reviewer.md",
      "model": "gpt-5.3-codex",
      "tools": ["Read", "Grep"],
      "codex_tools_ignored": true,
      "status": "active",
      "archived_at": null,
      "archived_bundle_path": null,
      "archived_original_scope": null,
      "archived_original_workspace": null
    }
  ],
  "mcp_servers": [
    {
      "server_key": "exa",
      "scope": "global",
      "workspace": null,
      "transport": "http",
      "command": null,
      "args": [],
      "url": "https://mcp.exa.ai/mcp",
      "env": {},
      "enabled_by_agent": {
        "codex": true,
        "claude": true,
        "project": false
      },
      "targets": [
        "/Users/example/.codex/config.toml",
        "/Users/example/.claude/settings.local.json"
      ],
      "warnings": [],
      "status": "active",
      "archived_at": null
    }
  ],
  "top_skills": ["skill-abc123def456"],
  "top_subagents": ["subagent-abc123def456"]
}
