{
  "version": 2,
  "generated_at": "",
  "sync": {
    "status": "unknown",
    "last_started_at": null,
    "last_finished_at": null,
    "duration_ms": null,
    "error": null,
    "warnings": []
  },
  "summary": {
    "global_count": 0,
    "project_count": 0,
    "conflict_count": 0,
    "mcp_count": 0,
    "mcp_warning_count": 0
  },
  "subagent_summary": {
    "global_count": 0,
    "project_count": 0,
    "conflict_count": 0,
    "mcp_count": 0,
    "mcp_warning_count": 0
  },
  "skills": [],
  "subagents": [],
  "mcp_servers": [],
  "top_skills": [],
  "top_subagents": []
}
